korname,engname,update,aff,bs,ms,phd,advisor,advisor2,handle,debut,mathgen,mrauthid,scholar,website,thesis,hide
조윤주,Yoon Joo Jo,201908,Texas A&M University 경제학과 (미국),2004,,,,,,2019,,,N4IceroAAAAJ,https://sites.google.com/view/yoonjoojo/home,,
조윤형,Yunhyung Cho,201703,성균관대학교 수학교육과,1999,,2010,서동엽,,41948,2010,186726,997968,VzXg-GsAAAAJ,https://sites.google.com/site/yhchomath/,Circle actions on symplectic manifolds,
조진환,Jin-Hwan Cho,,NIMS 산업수학혁신센터,,1992,1999,서동엽,,41809,1999,73791,620763,,https://icim.nims.re.kr/pageView/6,Algebraic realization problems for low dimensional G-manifolds,
조철현,Cheol-Hyun Cho,200702,서울대학교 수리과학부,1992,,,,,,2003,81675,717939,dIrkRwcAAAAJ,http://www.math.snu.ac.kr/~chocheol/,"Holomorphic discs, spin structures and Floer cohomology of the Clifford torus",
조혜림,Heyrim Cho,201907,아리조나주립대학교 수리 및 통계과학부 (미국),2003,2007,,,,,2015,270229,979435,cvEzBRYAAAAJ,https://heyrim.github.io/,High-Dimensional Response-Excitation PDFMethods for Uncertainty Quantification andStochastic Modeling,
좌준수,Jun Soo Choa,,성균관대학교 수학교육과 [2022년 별세],,1984,1989,김홍오,,41757,1989,,48595,,https://mathsci.kaist.ac.kr/home/alumni-news/좌준수/,Function spaces and composition properties of holomorphic functions on the unit ball of Cn,
주원영,Weonyoung Joo,202203,이화여자대학교 통계학과,2009,2014,,,,,2020,,1384601,r2eJgW4AAAAJ,http://www.ewha.ac.kr/ewha/professor/info.do?mode=view&pId=JDtZ1J%2FL11IOH%2BCTXAL4Zw%3D%3D,,
지상문,Sang-Mun Chi,200109,경성대학교 소프트웨어학과,,1991,,,,,1998,,,,https://kscms.ks.ac.kr/software/CMS/ProfessorMgr/list.do?mCode=MN024,,
진상돈,Sangdon Jin,202303,충북대학교 수학교육과,,2013,2020,변재형,,283581,2020,,1278097,,https://sites.google.com/view/sangdonjin,Variational methods for singularly perturbed problems,
진범자,Bumja Jin,,목포대학교 수학교육과,,1995,2000,최희준,,41829,2000,,669574,,https://mmed.mokpo.ac.kr/mmed/2739/subview.do,Existence of solutions of the compressible Navier-Stokes equations,
차병철,Byungchul Cha,202501,홍익대학교 수학교육과,1990,,,,,,2003,77480,754933,,https://sites.google.com/view/byungchulcha/,Vanishing of Some Cohomology Groups and Bounds for the Order of Shaferevich-Tate Groups of Elliptic Curves,
차재춘,Jae Choon Cha,200009,POSTECH 수학과,1989,1993,2000,고기형,,41825,2000,51560,630269,BJLT0IIAAAAJ,https://gt.postech.ac.kr/~jccha/,Links in rational homology spheres,
채희준,Hi-joon Chae,200003,홍익대학교 수학교육과,1986,,,,,,1994,,612182,,https://math.hongik.ac.kr/math/0201.do?mode=view&deptCd=AAF130&S1=2000&S2=10040,,
천정희,Jung Hee Cheon,,서울대학교 수리과학부,1987,1991,1997,한상근,,41791,1997,121962,616553,KlTc3U4AAAAJ,http://www.math.snu.ac.kr/~jhcheon/xe2/,The orders of the reductions of a point in the mordell-weil group of an elliptic curve,
천창범,Changbum Chun,,성균관대학교 수학과,,1987,,,,,1999,38288,658866,,https://skb.skku.edu/math/faculty.do?mode=view&perId=LZStrBodw1AWgkgtgjAKQMYGsDCKogGICECaAlsFABwCCAvJUA,Error Estimates for the Bifurcation Function for Semilinear Elliptic Boundary Value Problems,
최경진,Kyoung Jin Choi,201107,"University of Calgary, Haskayne School of Business (캐나다)",,1998,2004,곽도영,구형건,41872,2004,,781141,mQVpjNUAAAAJ,https://sites.google.com/site/kyoungjinchoiecon/,Discretionary stopping in an optimal consumption and portfolio seletion problem,
최대식,Daeshik Choi,201808,Lake Superior State University 수학과 (미국),,2001,,,,,2013,208755,970754,,https://www.linkedin.com/in/daeshik-choi-154540a0/,Estimating Norms of Matrix Functions using Numerical Ranges,1
최두일,Doo Il Choi,,한라대학교 교양과정부,,1989,1996,최봉대,,41779,1996,,629131,,https://cms.halla.ac.kr/user/indexSub.action?codyMenuSeq=15256&siteId=education,Performance analysis of threshold-based queueing system and its application to ATM networks,
최두호,Doo Ho Choi,202103,고려대학교 인공지능사이버보안학과,,1994,2002,고기형,,41845,2002,78716,696826,N4FHafMAAAAJ,https://aisecu.korea.ac.kr/faculty/,On 1-bridge torus knots,
최범준,Beomjun Choi,202107,POSTECH 수학과,2007,,,,,,2019,269098,1269631,StHXLu8AAAAJ,https://sites.google.com/site/mathbeomjun/,Non-compact geometric flows: long time existence and type II singularities,
최석웅,Sukwoong Choi,202406,뉴욕주립대 올바니 경영대학 (미국),2006,,,,,,2019,,,uHkRlUoAAAAJ,https://sukwoongchoi.github.io,,
최소영,SoYoung Choi,201509,경상대학교 수학교육과,,1995,2004,구자경,,41873,2004,179413,754586,,https://www.gnu.ac.kr/mathedu/pi/prfsr/selectPrfsrIntrdView.do?mi=7845&ctgrySn=1351,Class fields related to the Thompson series and certain arithmetic curves,
최수영,Suyoung Choi,201103,아주대학교 수학과,2000,2003,2009,서동엽,,41914,2009,149272,857177,91jZsq4AAAAJ,http://acmi.ajou.ac.kr/~schoi/,Properties determined by cohomology ring in toric topology,
최우현,W. Jason Choi,202209,메릴랜드 대학교 Robert H. Smith School of Business (미국),2006,,,,,,2020,,,2RfCojkAAAAJ,https://sites.google.com/view/wjasonchoi?fbclid=IwAR2H6pQjExxR1C5H6ae7Tj2E-RC2U7Tf6iFzs3lu1cMZLtKOiQWxXoYU7I8,,
최재혁,Jaehyuk Choi,202501,"Coumbia University, Mathematics of Finance (MAFN) Program (미국)",1994,,,,,,2005,92709,788415,tJfJ_5gAAAAJ,https://jaehyukchoi.net/,Transport-Limited Aggregation and Dense Granular Flow,
최정옥,Jeong Ok Choi,201109,GIST 수리과학과,1993,,,,,,2008,130517,895217,,https://las.gist.ac.kr/prog/gsPerson/las/P/list.do?gubunName=Faculty&mno=sub02_01,,
최진혁,Jin Hyuk Choi,201608,UNIST 수리과학과,2001,,,,,,2012,177000,1046316,ESBKuqIAAAAJ,https://sites.google.com/site/gubukhyuk/,A shadow-price approach of the problem of optimal investment/consumption with proportional transaction costs and utilities of power type,
탁병주,Byungjoo Tak,202409,건국대학교 수학교육과,,2011,,,,,2017,,,NUnouLsAAAAJ,https://sites.google.com/view/bjtak/home,,
탁재영,Jae-Young Tak,201703,동의대학교 산업ICT기술공학전공,,1986,,,,,1988,,,,https://ind-ict.deu.ac.kr/ind-ict/sub02.do#teacCon1,,
한강진,Kangjin Han,201501,DGIST 기초학부,1998,2002,2010,곽시종,,41936,2010,161219,985869,bLg4ssQAAAAJ,https://hilbert.dgist.ac.kr/site/KJ.html,"A study on some infinitely generated graded modules, projections, and applications",
한동준,Dong-Jun Han,202409,연세대학교 컴퓨터과학과,2011,,,,,,2022,,,-YR-GxUAAAAJ,https://sites.google.com/view/djhan930/members,,
한동환,Dong Hwan Han,,선문대학교 제약생명공학과,,1987,1993,최봉대,,41765,1993,,335619,,https://btpe.sunmoon.ac.kr/btpe/ad/pp/profsrintrcnPage.do?mi=40799,Queueing system with retrials and vacations,
허미경,Vera Mikyoung Hur,200908,UIUC 수학과 (미국),1995,,,,,,2006,35096,782185,JgfKadUAAAAJ,https://faculty.math.illinois.edu/~verahur,Steady Water Waves with Vorticity,
허석문,Sukmoon Huh,201103,성균관대학교 수학과,1996,,,,,,2007,136459,886034,,https://professor.skku.edu/researcher_eng/professorList.do?mode=view&perId=LZStrMYZgggGiwI4EwwKJgHYBsICMASAZEA7gPIBmBAvOUA%20&categoryId=U&jojikCode1=3172&jojikCode2=317202,Moduli Spaces of Stable Sheaves on a Plane and an Embedded Curve,
허영미,Youngmi Hur,201403,연세대학교 수학과,1993,1997,,,,,2006,106288,805869,TJLvYiEAAAAJ,http://wavelets.yonsei.ac.kr/~wavelets/,Novel Methodologies for Effective Wavelet Constructions in High Dimensions,
허영식,Youngsik Huh,2004,한양대학교 수학과,1989,1993,2000,진교택,,41826,2000,,693037,bb-rXIUAAAAJ,https://sites.google.com/site/youngsikhuh/home,Projections of theta-m curves and finite-type invariants of theta curves,
허철원,Cheolwon Heo,202502,SUNY Korea 응용수학통계학과,2005,,,,,,2021,279873,1468070,BurgUAAAAJ,https://sites.google.com/view/cwheo,,
허충길,Chung-Kil Hur,201309,서울대학교 컴퓨터공학과,1995,,,,,,2010,185123,846000,ognOntwAAAAJ,https://sf.snu.ac.kr/gil.hur/,Categorical equational systems: algebraic models and equational reasoning,
현동훈,David Donghoon Hyeon,2015,서울대학교 수리과학부,1992,,,,,,2001,49332,673409,,,Moduli questions for augmented bundles,1
홍순조,Sonja Hong,201709,홍익대학교 교양과,,,2009,신수진,,41926,2009,136625,873722,,https://www.hongik.ac.kr/kr/education/intro-university.do?mode=prof&deptCd=B33100&S1=2017&S2=10045,Renewal systems and their generating sets,
황강욱,Gang Uk Hwang,,KAIST 수리과학과,1987,1991,1997,최봉대,,41789,1997,230574,628134,,http://queue.kaist.ac.kr/~guhwang/,The MAP/G/1 queue and its applications to ATM networks,
황동선,DongSeon Hwang,202203,IBS 복소기하학연구단,1999,,2009,곽시종,금종해,41922,2009,166440,933189,04vFx7EAAAAJ,,On homology projective planes,
Harvey Rosas,,201207,Universidad de Valparaíso 통계학과 (칠레),,2004,2011,길이만,김성호,181563,2011,,,,https://www.linkedin.com/in/harvey-rosas-96732322/?originalSubdomain=cl,Text mining based on conditional probability output networks,
Darkhijav Bayanjargal,,,National university of Mongolia (몽골),,,2009,곽도영,,41924,,,616727,,,A conservative covolume method for the navier-stokes equations,
양대원,Daewon Yang,202303,충남대학교 통계학과,2011,,2021,정연승,,294694,,,,,https://stat.cnu.ac.kr/stat/faculty/faculty01.do?mode=view&key=LZStrEwBmGYEYRAWAOIA%20&pager.offset=0&pagerLimit=10,Nonparametric Bayesian hierarchical model and multivariate meta-regression model for environmental epidemiology study,
Haojun Li,,,"Yanbian University of Science and Technology, School of Materials, Mechanical & Automation Engineering (중국)",,2004,,,,,,,,,,,
Fayyaz Ahmad,,,University of Gujrat (파키스탄),,,2010,김성호,,41949,,,,3gY3OX0AAAAJ,https://uog.edu.pk/offices/euo57cea53bd4c26/fayyaz-ahmad,A neighborhood method for statistical analysis of fMRI data,