korname,engname,update,aff,bs,ms,phd,advisor,advisor2,handle,debut,mathgen,mrauthid,scholar,website,thesis,hide
신동화,Dong Hwa Shin,201203,한국외국어대학교 수학과,1998,2004,2010,구자경,,41932,2010,179417,884923,,http://builder.hufs.ac.kr/user/indexSub.action?codyMenuSeq=124320384&siteId=math2&menuType=T&uId=1&sortChar=A&menuFrame=left&linkUrl=1_2.html&mainFrame=right,Arithmetic properties of Siegel functions and applications,
신민석,Minseok Shin,202409,포스텍 산업경영공학과,2013,,,,,,,,,,,,
신수진,Sujin Shin,200203,KAIST 수리과학과,1987,,,,,,1999,35157,682689,,,Measures that maximize weighted entropy for factor maps between subshifts of finite type,1
신승훈,Sean Seunghun Shin,202408,KAIST 경영공학부,2006,,,,,,2017,,,owKeLcEAAAAJ,https://sites.google.com/view/s-shin/,,
신양우,Yang Woo Shin,,창원대학교 통계학과,,1984,1991,최봉대,,41760,1991,,320024,,https://www.changwon.ac.kr/stat/stf/stfView/staffView.do?rolecd=TSAL&staffTy=EXCP&mi=5558,Transient diffusion approximation for the G/G/m queueing systems,
신용현,Yong Hyun Shin,201409,숙명여자대학교 수학과,,2000,2007,최우진,구형건,41889,2007,143361,817466,KRQOCdoAAAAJ,https://sites.google.com/site/yonghyunshin1972/,"Optimal portfolio, consumption-leisure and retirement choice problem",
신정우,Jungwoo Shin,201609,경희대학교 산업경영공학과,2002,,,,,,2012,,,hEHWNiIAAAAJ,https://www.tmlabkyunghee.com/about-me,,
신희성,Heesung Shin,201103,인하대학교 수학과,1996,1999,2007,김동수,,41898,2007,125703,746276,5Jk18IAAAAJ,http://hshin.info/,A refinement of numbers for trees and parking functions,
안병희,Byung Hee An,202003,경북대학교 수학교육과,1997,2001,2010,고기형,,41937,2010,145736,914644,qsTIuOgAAAAJ,https://geometry.knu.ac.kr/~anbyhee/,A family of representations of braid groups on surfaces,
안성준,Sung Jun An,202010,제주한라대학교 지능형시스템공학과,,2002,2010,김성호,길이만,41935,2010,,,8cz7gA4AAAAJ,https://www.halla.page/p/blog-page_1.html,"Zero-crossing-based sound source localization, segregation and recognition",
안영준,Young Joon Ahn,,조선대학교 수학교육과,,1992,1998,김홍오,,41802,1998,,621937,,http://ahn.chosun.ac.kr/partition.html,Approximations of planar curves by quadratic rational B-splines,
안영호,Young-Ho Ahn,,목포대학교 수학교육과,,1992,2000,최건호,,41819,2000,143511,632820,,https://mmed.mokpo.ac.kr/mmed/2739/subview.do,Skew products arising from ergodic transformations,
안재현,Jaehyun Ahn,,충남대학교 수학과,1991,1995,2003,배성한,,41860,2003,64047,697105,,https://math.cnu.ac.kr/math/people/faculty01.do?mode=view&key=LZStrEwBhBYEYxA2I&siteId=math,Cyclotomic units and stickelberger ideals over global function fields,
양성덕,Seong-Deog Yang,,고려대학교 수학과,1986,,,,,,1997,69337,673171,,https://mathematicians.korea.ac.kr/sdyang/,On a Connected Sum Construction for Complete Minimal Surfaces of Finite Total curvature,
엄상일,Sang-il Oum,202408,IBS 이산수학그룹,1994,,,,,,2005,92455,765385,EsMssA0AAAAJ,https://dimag.ibs.re.kr/home/sangil/,Graphs of Bounded Rank-Width,
엄익선,Ick Sun Eum,201609,동국대학교 수학교육과,,2006,2012,구자경,,181554,2012,179419,915624,,https://mathedu.dongguk.ac.kr/HOME/mathedu/sub.htm?nav_code=mat1589161324,Some studies on Klein forms and Eisenstein series,
오덕순,Duk-Soon Oh,202003,충남대학교 수학과,1998,,,,,,2011,178042,1011821,d2C_Y54AAAAJ,https://sites.google.com/view/duksoonoh,Domain Decomposition Methods for Raviart-Thomas Vector Fields,
오성진,Sung-Jin Oh,201909,UC Berkeley 수학과 (미국),2006,,,,,,2013,273323,1060366,,https://math.berkeley.edu/~sjoh/,Finite energy global well-posedness of the (3+1)-dimensional Yang-Mills equations using a Yang-Mills heat flow gauge,
오수호,Suho Oh,201408,Texas State University 수학과 (미국),2001,,,,,,2011,168024,850016,,https://faculty.txst.edu/profile/1922575,Combinatorics related to the Totally Nonnegative Grassmannian,
오승상,Seungsang Oh,,고려대학교 수학과,1988,,,,,,1996,45859,609855,x87uE4oAAAAJ,https://datascience.korea.ac.kr/ds/intro/math_fulltime_faculty.do?mode=view&articleNo=251913&article.offset=0&articleLimit=10,Exceptional Manifolds after Dehn Filling,
오재린,Jaelynn Oh,201308,"University of Utah, David Eccles School of Business (미국)",2000,,,,,,2014,,,6PSsQSkAAAAJ,https://faculty.utah.edu/u0917183-JAELYNN_OH/hm/index.hml,,
오정석,Jeongseok Oh,202403,서울대학교 수리과학부,2005,,2017,서동엽,,241910,2017,280220,1281147,0VOzmFEAAAAJ,https://sites.google.com/view/jeongseokoh/,Quasimap theory and its applications to mirror symmetry,
오종철,Jong Chul Oh,,군산대학교 수학과,,1987,1995,김병천,,41774,1995,,608146,,https://www.kunsan.ac.kr/math/index.kunsan?menuCd=DOM_000007102001000000,Studies on choosing the bandwidth in a kernel regression estimation,
오준호,Junho Oh,202203,한국외국어대학교 경영대학,2006,,,,,,,,,,https://builder.hufs.ac.kr/user/indexSub.action?codyMenuSeq=136419507&siteId=hufsbizz&menuType=T&uId=3&sortChar=A&linkUrl=3_list135430760&dum=dum&boardId=136418948&page=1&command=albumView&boardSeq=160417913&categoryDepth=&search=오준호&column=title,,
유병훈,Byeong Hoon Yoo,,안동대학교 수학교육과,,1986,1994,권길헌,,41766,1994,,327103,,https://mathedu.andong.ac.kr/module/prof/list.php?mid=/introduce/professor&prcode=professor,Characterizations of orthogonal polynomials satisfying differential equations,
유상현,Sanghyeon Yu,201909,고려대학교 수학과,,2009,2015,임미경,,206324,2015,,959778,rniqBGQAAAAJ,https://sites.google.com/site/shyu85/,Analysis of stress concentration and plasmon resonance,
윤동성,Dong Sung Yoon,201809,부산대학교 수학교육과,2002,2006,2013,구자경,,197739,2013,179379,950306,,https://sites.google.com/site/mathdsyoon,Construction of class fields over certain CM fields,
윤병인,Beong In Yun,,군산대학교 통계컴퓨터과학과,1986,1990,1996,최우진,,41784,1996,154813,607578,mIGGm8MAAAAJ,https://www.kunsan.ac.kr/scs/index.kunsan?menuCd=DOM_000007202000000000,Analytic function approach and numerical boundary integral method to the elasticity,
윤석민,Sukmin Yoon,202402,한양대학교 인공지능학과,2012,,,,,,,,,fQcZ_hQAAAAJ,https://sites.google.com/view/sukmin-yun,,
윤석훈,Seokhoon Yun,,수원대학교 데이터과학부 [2020년 별세],,1983,,,,,1994,47508,617794,,http://www.kss.or.kr/bbs/board.php?bo_table=familyEvent&wr_id=295&sst=wr_hit&sod=asc&sop=and&page=4,Extremes and Threshold Exceedances in Higher Order Markov Chains with Applications to Ground-Level Ozone,
윤아람,Aaram Yun,201903,이화여대학교 사이버보안학과,1991,,,,,,2001,59884,759278,WyIVD6UAAAAJ,http://www.ewha.kr/ewha/academics/eltec-engineering-prof.do?mode=view&pId=rou3lVdUg9mb7qvocGX9aA==,Discrete Subgroups of the Special Linear Group with Thin Limit Sets,
윤정록,Jeong-Rock Yoon,,"Clemson University, School of Mathematical and Statistical Sciences (미국)",,1993,2001,최우진,,197751,2001,156601,638022,,http://jryoon.people.clemson.edu/,"Inverse problems for reconstructive imaging of inhomogeneities inside the body : mathematical theory, numerical algorithms, and biomedical applications",
윤지희,Ji Hee Yoon,202207,University College London 경제학과 (영국),2002,2006,2011,최우진,,41956,2011,,940870,,https://sites.google.com/site/jiyoonmath/home,Financial derivative pricing under stochastic market environments,
윤창욱,Changwook Yoon,202103,충남대학교 수학과,,2008,2015,김용정,,206323,2015,,1100397,mXQbr_4AAAAJ,https://mathedu.cnu.ac.kr/mathedu/intro/faculty01.do?mode=view&key=LZStrEwBmEZxEDYA4g%20&pager.offset=0&pagerLimit=10,Mathematical understanding of biological diffusion,
이광희,Kwang Hee Lee,202406,금오공과대학교 컴퓨터소프트웨어공학과,2009,,,,,,2023,,,TwbFnVYAAAAJ,https://kwangheeya.github.io,,
이경섭,Kyungsub Lee,201509,영남대학교 통계학과,2001,2006,2012,최건호,,181556,2012,194288,1078484,ucjucwwAAAAJ,https://sites.google.com/view/ksublee,GARCH intensity model and new methods of option pricing,
이경현,Kyung Hyune Rhee,,부경대학교 IT융합응용공학과,,1983,1992,최봉대,,41752,1992,,,,https://cms.pknu.ac.kr/itcae/view.do?no=9560&viewType=view&idx=1836,M/G/1 retrial queueing system and its applications to the CSMA/CD protocol,
이계선,Gye-Seon Lee,202203,서울대학교 수리과학부,1998,2002,2010,최서영,,41945,2010,167751,832440,,http://www.math.snu.ac.kr/~gyeseonlee/,Projective deformations of hyperbolic coxeter 3-orbifolds,
이남길,Namgil Lee,201703,강원대학교 정보통계학과,2000,2004,2013,김성호,,181551,2013,209262,930304,,https://sites.google.com/site/namgil,Bayesian approach to shrinkage estimation for large scale vector autoregressive models,
이덕균,Dokkyun Yi,201503,대구대학교 자유전공학부,,1998,2005,이성연,,41887,2005,,769638,,https://slac.daegu.ac.kr/hakgwa_home/slac/sub.php?menu=page&menu_id=1036,Research on mathematical modelling in image processing,
이동원,Dong Won Lee,,경북대학교 수학교육과,1986,1990,1996,권길헌,,41785,1996,,357717,,https://home.knu.ac.kr/HOME/mathedu/sub.htm?nav_code=mat1623140750,Differential equations having orthogonal polynomial solutions,
이민기,Min-Gi Lee,201809,경북대학교 수학과,1999,2007,2014,김용정,,197747,2014,,1090007,SSZ7EjEAAAAJ,https://cebumactan.github.io/ming-lee/,Well-posedness in anisotropic conductivity reconstruction,
이민혁,MinHyuk Lee,202009,부산대학교 경영학과,2009,,,,,,2018,,,loxvM7YAAAAJ,https://biz.pusan.ac.kr/biz/52294/subview.do?enc=Zm5jdDF8QEB8JTJGcG51UHJvZmwlMkZiaXolMkYxNzg5JTJGMTg3MzclMkZhcnRjbFZpZXcuZG8lM0ZmaW5kVHlwZSUzRCUyNmZpbmRXb3JkJTNEJTI2cGFnZSUzRDElMjY=,,
이병국,Byung Gook Lee,1995,동서대학교 컴퓨터공학과,,1987,1993,김병천,,41764,1993,,337620,6ZGFa8YAAAAJ,http://kowon.dongseo.ac.kr/~lbg/,A data based algorithm for choosing the bandwidth in the nonparametric estimation,
이상엽,Sangyop Lee,200803,중앙대학교 수학과,1990,1994,2001,진교택,,41842,2001,51673,696815,,http://cau.ac.kr/~sylee/,Dehn fillings and small surfaces,
이상진,Sang-Jin Lee,200309,건국대학교 수학과,1988,1992,2000,고기형,,41820,2000,51670,604136,iS-5jSoAAAAJ,https://sites.google.com/view/sangjin,Algorithmic solutions to decision problems in the braid groups,
이승규,Seunggyu Lee,202103,고려대학교 응용수리과학부,2007,,,,,,2016,,1038751,U-HiuG4AAAAJ,https://sites.google.com/view/sglee,,
이승진,Seung Jin Lee,201703,서울대학교 수리과학부,2005,2007,,,,,2013,175854,1010614,,https://sites.google.com/site/lsjin1986/seung-jin-lees-hompage,Centrally symmetric polytopes with many faces,
이애자,Ae Ja Yee,200308,The Pennsylvania State University 수학과 (미국),,1993,2000,김동수,,41824,2000,115140,650910,,https://science.psu.edu/math/people/auy2,Combinatorial interpretation of lecture hall partitions,
이언경,Eon-Kyung Lee,,세종대학교 수학통계학부,1988,1992,2001,한상근,,41838,2001,137292,361936,,http://home.sejong.ac.kr/~eonkyung/,A study of provably secure pseudo-random generator and hard-core predicate,
이영주,Young Joo Lee,200509,전남대학교 수학과,,1989,1994,최부림,,41767,1994,,336959,,https://sites.google.com/view/leeyjhome/,Some contributions to Toeplitz operators on the Bergman spaces,
이영호,Youngho Lee,200909,목포대학교 컴퓨터공학과,1995,,,,,,2008,,,je6DowQAAAAJ,https://uvr.ce.mokpo.ac.kr/members,,
이완석,Wanseok Lee,201403,부경대학교 응용수학과,,2002,2009,곽시종,,41920,2009,181212,929350,,https://math.pknu.ac.kr/math/318?action=view&no=19401121,On projective varieties of almost minimal degree,
이용완,Yong Wan Lee,,안동대학교 수학교육과 [명예교수],,,1995,최봉대,,41772,1995,,360664,,https://mathedu.andong.ac.kr/module/prof/list.php?mid=/introduce/professor2&prcode=professor2,On the retrial queueing systems,
이용훈,Yong Hun Lee,,전북대학교 수학과,,1987,1996,김홍오,김상동,41787,1996,,615879,,https://math.jbnu.ac.kr/math/10958/subview.do?enc=Zm5jdDF8QEB8JTJGamJudVByb2ZsJTJGbWF0aCUyRjQyJTJGMTc1JTJGYXJ0Y2xWaWV3LmRvJTNGcGFnZSUzRDElMjZmaW5kVHlwZSUzRCUyNmZpbmRXb3JkJTNEJTI2,Finite difference preconditioning cubic spline collocation method,
이유태,Yutae Lee,200103,동의대학교 정보통신공학과,1988,1992,1997,최봉대,,41792,1997,,629149,,http://hyomin.deu.ac.kr/~ylee/,Priority queueing systems and its applications to ATM networks,
이은정,Eunjeong Lee,202203,충북대학교 수학과,2005,2009,2018,서동엽,,264940,2018,265979,1128774,uKHWKYEAAAAJ,https://sites.google.com/view/eunjeonglee/,Topology and geometry of flag Bott-Samelson varieties and Bott towers,
이은주,Eunju Lee,202408,Louisiana State University 경제학과,2010,,,,,,,,,,https://sites.google.com/view/eunju-lee,,
이응현,Eunghyun Lee,201508,Nazarbayev University 수학과 (카자흐스탄),,2002,,,,,2011,156295,849051,Bk-6Hx8AAAAJ,https://sites.google.com/a/nu.edu.kz/eunghyun-lee-s-homepage/,Bethe Ansatz Solvable Interacting Particle Systems on Z,
이일빈,Ilbin Lee,201707,"University of Alberta, School of Business (캐나다)",2000,,,,,,2015,211845,1064242,pK-t_RUAAAAJ,https://sites.google.com/site/ilbinleewebpage/,Analysis and Simplex-type Algorithms for Countably Infinite Linear Programming Models of Markov Decision Processes,
이장택,Jang Taek Lee,,단국대학교 응용통계학과,,1983,1988,김병천,,41754,1988,,236904,,https://cms.dankook.ac.kr/web/dkustat/-4?p_p_id=DeptInfo_WAR_empInfoportlet&p_p_lifecycle=0&p_p_state=normal&p_p_mode=view&p_p_col_id=column-2&p_p_col_count=1&_DeptInfo_WAR_empInfoportlet_empId=PYNSHdYxOeBpFgw5DOl8ug%3D%3D&_DeptInfo_WAR_empInfoportlet_action=view_message,Estimation of variance components for mixed models with cell means,
이재람,Jaeram Lee,202403,한국외국어대학교 경영학부,2006,,,,,,2015,,,pcqUvjYAAAAJ,https://biz.hufs.ac.kr/biz/7853/subview.do?enc=Zm5jdDF8QEB8JTJGcHJvZmwlMkZiaXolMkY0MTglMkY0NDIxJTJGYXJ0Y2xWaWV3LmRvJTNGcGFnZSUzRDElMjZzcmNoQ29sdW1uJTNEJTI2c3JjaFdyZCUzRCUyNg%3D%3D,,
이재우,Jaewoo Lee,,CUNY BMCC 수학과 (미국),1988,,,,,,2006,99826,902328,,https://www.bmcc.cuny.edu/faculty/jaewoo-lee/,,
이재헌,Jaeheon Lee,2004,중앙대학교 응용통계학과,,,1994,김병천,,41771,1994,,350490,,https://sites.google.com/view/spm-lab/professor,A simple and improved approximation method for the characteristics of sequential tests,
이정근,Jeong-Keun Lee,,선문대학교 산업안전경영공학과,,1984,1992,김문언,권길헌,41750,1992,,,,https://ie.sunmoon.ac.kr/ie/ad/pp/profsrintrcnPage.do?mi=40374,Linear functionals on space of polynomials and their application to semiclassical orthogonal polynomials,
이정욱,Junguk Lee,202303,창원대학교 수학과,2005,,,,,,2016,,1099787,,https://sites.google.com/site/leejunguk0323/home,,
이정훈,Jung-Hoon Lee,,전북대학교 수학과,1994,1998,2005,진교택,,41884,2005,119212,696063,,https://sites.google.com/view/junghoon123,Heegaard splittings of knot and link complements,
이준경,Joonkyung Lee,202303,연세대학교 수학과,2005,2008,,,,,2018,,984393,PJQ5eUcAAAAJ,https://sites.google.com/site/joonkyungleemaths/,,
이준연,Jun-Yeon Lee,201108,"CSU Northridge, Department of Systems and Operations Management (미국)",1986,,,,,,2004,,,pFeglNoAAAAJ,https://www.csun.edu/som/jun-yeon-lee,,
이준엽,June-Yub Lee,,이화여자대학교 수학과,1986,,,,,,1994,33479,361807,,http://math.ewha.ac.kr/~jylee/,Adaptive Numerical Methods for Singular Perturbation Problems in One Space Dimension,1
이준용,Junyong Lee,202403,국민대학교 국제통상학과,2013,,,,,,2023,,,FNVkFjIAAAAJ,,,
이창옥,Chang-Ock Lee,200609,KAIST 수리과학과,,1984,,,,,1995,11548,364533,mR0fSF8AAAAJ,http://amath.kaist.ac.kr/~colee/,"Multigrid Methods and Parallel Computations for Elliptic Problems, with and Emphasis of Linear Elasticity",
이창준,Changjun Lee,201203,한국외국어대학교 경영학부,1999,,,,,,,,,ThcnRjkAAAAJ,https://www.hufs.ac.kr/user/indexFrame.action?framePath=div3_1.jsp&siteId=hufs&leftPage=&rightPage=03_010901b.html&codyMenuSeq=37045,,
이한국,Hankook Lee,202403,성균관대학교 소프트웨어학과,2010,,,,,,,,,CgqswXUAAAAJ,https://hankook.github.io/,,
이한주,Han Ju Lee,,동국대학교 수학교육과,,1999,2004,최창선,,41877,2004,110011,738542,,https://dume.dongguk.edu/professor/list?professor_haggwa_type=PROFH_050,"Extension of polynomials, complex convexity and M-ideal properties of Banach function spaces",
이형숙,Hyung Sook Lee,,미국 Eastern Washington University 수학과,,1998,,,,,,,,-5rIvL8AAAAJ,https://www.ewu.edu/experts/hyung-sook-lee/,,
이형천,Hyung-Chun Lee,,아주대학교 수학과 [명예교수],,1984,,,,,1994,75530,353631,vPDOviQAAAAJ,https://math.ajou.ac.kr/math/member/member06.jsp?include=view&article_no=202210569&board_wrapper=%2Fmath%2Fmember%2Fmember06.jsp&pager.offset=0&board_no=849,"Analysis, Finite Element Approximation, and Computation of Optimal and Feedback Control Problems",
이호석,Ho-Seok Lee,201603,광운대학교 수학과,1998,2002,2009,최우진,,41917,2009,,831682,,https://klas.kw.ac.kr/ext/out/RsrchInfoUpdtViewSpvPage.do?memberNo=12016009,Risk models and their applications to credit derivatives and insurance,
이화정,Hwa Jeong Lee,201903,동국대학교 수학교육과,,2000,2010,진교택,,41947,2010,148838,988416,,https://sites.google.com/site/leehwajeong/,Prime knots whose arc index is smaller than the crossing number,
이효정,Iona Hyojung Lee,201407,"Singapore Management University, School of Economics  (싱가포르)",2000,,,,,,2014,,,,https://faculty.smu.edu.sg/profile/iona-hyojung-lee-1911,,
이훈희,Hun Hee Lee,201303,서울대학교 수리과학부,1993,1997,2004,최창선,,41874,2004,110012,734722,,http://www.math.snu.ac.kr/~hhlee/,Fourier type and cotype with respect to unimodular groups,
임경수,Kyung Soo Rim,,서강대학교 수학과,,1990,1996,최우진,,41786,1996,156595,610323,,https://sites.google.com/view/professor-rim-kyung-soo,M-harmonic conjugate functions,
임병화,Byung Hwa Lim,202202,성균관대학교 경영대학,2000,2004,2009,최우진,,41918,2009,,817688,QE5z9eMAAAAJ,https://koreansli.skku.edu/researcher/professorList.do?mode=view&perId=LZStrKIQwSg0sA2BiCSBlCAJAjgdgE4BMAW0ADgDKED0AggLxVA &categoryId=G&jojikCode1=3169&jojikCode2=7101CR,Portfolio selection and asset pricing under asymmetric information,
임선혁,Sunhyuk Lim,202312,성균관대 수학과,2008,,,,,,2021,272697,,3LFl1bkAAAAJ,https://sites.google.com/view/sunhyuklim/,,
임성근,Sung Geun Lim,,목원대학교 수학교육과,1987,,,,,,2003,257406,760172,,https://www.mokwon.ac.kr/mathedu/html/sub02/0201.html,Square Classes of Positive Units over Real Number Fields,
임성수,Sungsu Lim,201809,충남대학교 컴퓨터공학과,2004,2009,,,,,2016,,1121259,cMQT0a8AAAAJ,http://www.sungsulim.com/,,
임재근,Jae Kun Lim,,한경대학교 응용수학전공,,1991,1998,김홍오,,41803,1998,135844,619485,,https://www.hknu.ac.kr/hkcommath/2054/subview.do,Frames and frame multiresolution analyses,
장봉규,Bong-Gyu Jang,200805,POSTECH 산업경영공학과,,,2004,최우진,,41878,2004,155862,802584,JE8ILzYAAAAJ,https://bgjang.postech.ac.kr/,Optimal consumption and investment decisions in the presence of transaction costs,
장우승,,,University of Missouri-Columbia 산업 및 생산시스템공학과,1988,,,,,,,,,,,,1
장현진,Hyun Jin Jang,201402,UNIST 경영과학부,,2004,2010,최건호,,41929,2010,194126,931919,F12YqyoAAAAJ,https://sites.google.com/site/janghj/,Credit risk modeling and credit derivatives pricing with copula functions,
장희동,HeeDong Chang,,호서대학교 게임소프트웨어학과,,1985,,,,,1995,,,,http://www.hoseo.ac.kr/Home/Major.mbz?action=MAPP_2005191589,,
전기완,Kiwan Jeon,,NIMS 산업수학연구본부,,2002,2010,이창옥,,41928,,262327,885351,,,Harmonic B_z Algorithms in Magnetic Resonance Electrical Impedance Tomography (MREIT) and Related Studies,
전대열,Daeyeol Jeon,,공주대학교 수학교육과,,1992,2001,배성한,,41839,2001,125268,658790,,https://math.kongju.ac.kr/ZA0510/10107/subview.do,Minimal models for drinfeld modules of rank 2 with complex multiplication,
전병현,Byounghyun Jeon,201908,University of Marquette 금융학과 (미국),2008,,,,,,2019,,,lueb5vEAAAAJ,https://www.marquette.edu/business/directory/byounghyun-jeon.php,,
전성찬,Sung Chan Jun,200709,GIST AI대학원,1987,1991,1998,최우진,,41804,1998,156000,648921,XfUOo6QAAAAJ,https://biocomput.gist.ac.kr/biocomput/35041.do,Iterative methods in inverse scattering problem,
전수민,Soomin Jeon,202209,동아대학교 정보수학과,2006,2010,2017,이창옥,,241914,2017,277504,1358556,9AHiTx0AAAAJ,http://web.donga.ac.kr/soominjeon/,CT metal artifact reduction based on sinogram surgery,
전영목,Youngmok Jeon,,아주대학교 수학과,,1983,,,,,1993,,339264,ZAZnK8MAAAAJ,https://math.ajou.ac.kr/math/member/member01.jsp?include=view&article_no=199411151&board_wrapper=/math/member/member01.jsp&pager.offset=0&board_no=309,,
전재웅,Jaiung Jun,201909,SUNY New Paltz 수학과 (미국),2003,,,,,,2015,190896,1161753,3g_Z1vEAAAAJ,https://sites.google.com/site/jaiungjun0915/,Algebraic geometry over semi-structures and hyper-structures of characteristic one,
전춘배,Choon Bae Jeon,,대덕대학 [2019년 별세],,1996,2003,진교택,,41859,2003,13951,677364,,"https://www.kms.or.kr/board/list.html?num=12897&start=30&sort=top desc,main desc,reg_dt desc&code=announce&tcode=&key=&keyword=",Studies on superbridge index of knots,
정강모,Kang-Mo Jung,,군산대학교 수학과,,1987,1997,김병천,,41790,1997,,611470,,https://www.kunsan.ac.kr/math/index.kunsan?menuCd=DOM_000007102001000000,Identification of influential observations in multivariate statistical methods,
정병선,Byeongseon Jeong,202109,계명대학교 수학전공,,2004,2012,권길헌,김홍오,197743,2012,,849954,,https://newcms.kmu.ac.kr/math/22158/subview.do,Non-stationary subdivision schemes generalizing exponential B-splines,
정수미,Sumi Jung,202108,연세대학교 경영대학,1998,,,,,,2015,,,,https://ysb.yonsei.ac.kr/faculty.asp?mid=m02&sOpt=A&uid=204,,
정연수,Yeon Soo Chung,,공군사관학교 전산통계학과 [명예교수],,,2003,김병천,,41856,2003,,736819,,,Adjustment of unemployment estimates based on small area estimation,
정용욱,Yong Wook Jung,,경기과학기술대학교 기계공학과,,1986,1997,최봉대,,41788,1997,,647539,,https://www.gtec.ac.kr/pme/cms/FrProfessorCon/ProfessorView.do?MENU_ID=130&CONTENTS_NO=&DEPT_CD=14&DEPT_CONT_CD=0&PROF_SEQ=68,Queueing system with bursty traffics and its applicaitons to ATM networks,
정의진,Uijin Jung,201303,아주대학교 수학과,1999,,2009,신수진,,41927,2009,135960,877849,X4IB5-gAAAAJ,http://math.ajou.ac.kr/math/member/member01.jsp?include=view&article_no=201310018&board_wrapper=/math/member/member01.jsp&pager.offset=0&board_no=309,Topological properties of factor maps in symbolic dynamics,1
정일효,Il-Hyo Jung,200203,부산대학교 수학과,,1991,1997,권길헌,,41793,1997,,357666,,https://math.pusan.ac.kr/math/15567/subview.do?enc=Zm5jdDF8QEB8JTJGcG51UHJvZmwlMkZtYXRoJTJGNDElMkY0MDE3JTJGYXJ0Y2xWaWV3LmRvJTNGZmluZFR5cGUlM0QlMjZmaW5kV29yZCUzRCUyNnBhZ2UlM0QxJTI2,Sobolev orthogonality and differential equations,
정종헌,Jongheon Jeong,202403,고려대학교 인공지능학과,2012,,,,,,,,,mZB2qfcAAAAJ,https://jh-jeong.github.io,,
정호윤,Ho Yun Jung,202003,단국대학교 수학과,2001,,2011,구자경,,181564,2011,179418,884886,,http://www.dankook.ac.kr/web/kor/-270?p_p_id=DeptInfo_WAR_empInfoportlet&p_p_lifecycle=0&p_p_state=normal&p_p_mode=view&p_p_col_id=column-2&p_p_col_count=1&_DeptInfo_WAR_empInfoportlet_viewNo=1&_DeptInfo_WAR_empInfoportlet_action=view,Ray class invariants and normal bases over imaginary quadratic fields by Siegel functions,
정호현,Hohyun Jung,202103,성신여자대학교 통계학과,2008,2012,2019,이지운,김성호,283236,2019,,1305340,,https://sites.google.com/view/hohyunjung,A study on the effects of fitness and popularity on network dynamics,
정환엽,Hwanyup Jung,,충북대학교 수학교육과,1988,1994,2001,배성한,,41831,2001,59579,638429,5fCJCGQAAAAJ,https://edu.chungbuk.ac.kr/mathedu/selectWebProfessorList.do?key=435,Cyclotomic units and central extensions of function fields,
정희선,Hee Sun Jung,,성균관대학교 수학교육과,,1994,2001,권길헌,,41837,2001,,632638,,https://coe.skku.edu/coe/intro/faculty_math.do?mode=view&perId=LZStrJYdQCgJgHALADANwGYGMCMAHAHig5ga2AHsBFACwGpcBeaoA,Mean convergence of interpolation polynomials for exponential weights,
조경희,Kyeonghee Jo,,목포해양대학교 교양과정부,1986,,,,,,2001,,706545,,https://www.mmu.ac.kr/S5/usrPositionprofessor,Quasi-homogeneous domains and projectively flat manifolds,
조광현,Gwanghyun Jo,201909,한양대학교 수리데이터사이언스학과,2007,2011,2018,곽도영,,264935,2018,,1201770,8BN1dJ7aXgMC,https://sites.google.com/view/gwanghyunjo/people/prof-gwanghyun-jo,An immersed finite element method for computing a two-phase flow in porous media,
조범규,Bumkyu Cho,201103,동국대학교 수학과,1995,2000,2009,구자경,,41908,2009,179416,865938,,https://math.dongguk.edu/professor/list?professor_haggwa_type=PROFH_011,Construction of class fields by Shimura's canonical models,
조용화,Yonghwa Cho,202403,경상대학교 수학과,2006,2010,2017,이용남,,325007,2017,,1243048,,https://sites.google.com/site/yhchoag,On derived categories of algebraic surfaces constructed via Q-Gorenstein smoothings,
